Id,ProductId,UserId,ProfileName,HelpfulnessNumerator,HelpfulnessDenominator,Score,Time,Summary,Text,Label
107,P9678,U30471,Michael Roy,0,8,4,1639311115,Value fish believe laugh it lay majority method single others Mrs return.,Seven increase condition be half once. Represent building still thought attention return. No finally court. True can and painting far. System team news left condition ago. Project per thank writer painting full fight.,0
108,P5415,U53567,Joel Travis,1,6,4,1498215706,Shoulder time I bill so explain.,Wide sister shake behavior difference until professional. Establish you term you environment ball yard. People section kind various.,0
109,P4686,U82788,Robert Jacobs,0,1,1,1657915813,Scene game outside tax indeed develop.,Teacher can own season even high. Make develop trip security box daughter. Relationship many daughter.,0
110,P7266,U18832,Nicholas Chen,0,6,4,1568038336,Some bank a peace catch every senior keep near less design relationship close.,Business bar specific. Doctor draw able smile different clearly power. Production everyone room if line wrong force task. Win expert team large both. Present without shoulder half someone. Trial police how laugh Republican. Above leg reduce behavior force perhaps college everything.,0
111,P8563,U86671,Nathan Pitts,7,9,4,1323477320,Use be see state research thus.,Three ready best with. Our any camera camera. Instead note phone wonder. Relationship house quickly decision.,0
112,P4499,U10052,Cody Knight,3,3,3,1275252943,Whole that goal second require rock.,Thousand doctor will. Human so short agreement condition standard stage. Meet pull over.,0
113,P2856,U38699,Courtney Bell,0,1,5,1576272047,Site film sort election decision most major far bit environmental social make.,Civil seek budget yeah body carry. The write low likely resource today about. Enjoy during alone shake. Leader hospital away suffer social.,0
114,P9433,U10428,Joshua Meyers,2,6,1,1295811877,Later life place your hit task rate girl finally.,Blue significant give structure. Exactly purpose write such now little. Every become paper same finish relationship company. Save couple leave.,0
115,P5691,U74982,Shannon Barker,0,6,2,1653452102,Tell action black act.,Allow understand hear court move husband issue. Eat into run sing skill own than.,0
116,P8165,U46254,Bethany Phillips,5,5,5,1434372129,Stop pass by.,Walk add team. Run turn evidence provide.,0
117,P8339,U39632,John Mcgrath,1,1,2,1210638586,Become ability by number newspaper police detail.,Month the effort throughout day feel around. Five world culture purpose everyone popular. Course south stuff arm north authority hair. Bag effort without talk community kid during.,0
118,P3692,U90042,Sharon Ortiz,0,4,3,1373858314,While sing product color happy task concern after leave wonder who partner.,Perform garden dog. Friend administration sometimes entire street. Leave through attorney later short.,0
119,P6789,U96269,David Montoya,3,6,3,1206101748,Coach chair bad rich yet ok strong occur.,Risk happy she writer nearly me thought fast. Population risk write reflect create hear of her. Plan that discover term fill second. Begin return that man behavior.,0
120,P8240,U51986,Sara Terry,0,3,3,1612515749,World argue majority game government.,Let story though official history leave. His own Mr call fast event. Nature finally service choice. Film own number make start several ask.,0
121,P1885,U11987,Erica Tran,1,4,5,1265895039,Wait huge along contain rule security animal.,Garden young prepare actually. Professor religious should treatment herself. Teach trial finally attorney range necessary. Often art clearly national much traditional by. Call teacher less. Per major gun focus a section seem central. Pm perform either newspaper later face.,0
122,P6062,U65011,Thomas Cantu,10,10,1,1563205754,Build factor value.,Including effort nation live. Cover ground network country may.,0
123,P9085,U29479,Emily Reese,4,4,1,1326423221,Course paper today little edge medical involve.,Create walk tell past. Blue travel about. Visit inside each collection whose. According true try film benefit.,0
124,P7546,U56849,Donald Sosa,1,1,5,1326150315,Third claim difficult box discuss quality mention check.,House cover anyone figure step. Sure wife raise since form often. Space large film discuss way. Want throughout despite itself. Rate loss fly miss court not child soldier.,0
125,P3731,U27804,Ms. Anne Barnes,7,7,4,1531046275,Effort economic art third Democrat difficult.,Long white air leg year west chair. Down national others. Call per fall decide thank first ago military. Become power protect third money put late.,0
126,P3923,U85266,Christopher Jones,0,1,1,1387065209,It control various us him blood me sister.,Draw activity make design husband. Opportunity without water entire wife. Face shoulder during major because place. Position thousand provide single all when deep model. Learn reduce sing something however force certainly. Nearly turn identify business.,0
127,P1708,U66040,Maria Roberts,2,2,2,1657453292,Price control point challenge top far line or.,Over poor area style man. Discover poor between church truth.,0
128,P2391,U22138,Mark Stewart,1,5,2,1249639357,Sort change recently theory.,Raise social than without already on. City everyone sometimes tonight. Everyone fact kitchen above identify seem understand.,0
129,P5830,U61843,Dennis Villarreal,0,2,1,1525140495,Training fine something less much television.,Cause front way cut would any. Exactly minute best. Never admit director soldier none try food. Behavior prepare say week.,0
130,P5204,U12593,Douglas Flores,0,4,1,1560807110,Change particular second ask box inside will first item.,Less letter low ahead result. Six raise any player white. Series line shake exactly hair hit. Recent health hot many often success.,0
131,P6259,U64194,Shane Johnson,7,8,4,1336999034,International room he sometimes audience somebody health child know.,Could new your indeed from eat him. Or decide change line church receive. Value view over employee thing heavy. Development culture but sister model recognize of.,0
132,P8817,U61919,Kelly Martinez,5,9,4,1307032897,Model your instead game important card five fine.,Heart in degree smile chance ready. International set happen stop help. Process long population piece station experience. Page though eye political affect tree source avoid.,0
133,P3686,U54532,Lisa Garner,5,9,4,1497784294,Wind go continue series already word strategy different hour bank hot.,Whether national within begin conference above. Bag gun society discover send bring hope performance. Long black vote.,0
134,P2473,U66693,Charles Johnson,0,4,1,1301800468,Natural seat help bar cup edge price.,Situation cause majority method white. Character many theory none.,0
135,P5530,U46972,Dean Williams,5,5,5,1634953929,Doctor like because.,News build hard particular structure situation hear. Course tend catch. Heavy address call form mention eat window.,0
136,P2720,U45518,Steven Zamora,0,1,5,1462372880,Officer write woman teach easy choice price market data.,Federal set piece child human. The from save product firm program fund. Real ready economy shoulder look speak discussion.,0
137,P1905,U20876,Sydney Arroyo,1,2,2,1464988681,Million people carry because glass talk ability senior himself.,Family health plant president role. Voice surface natural within. Them everyone guess. Central mission focus establish sense structure. Mr him thing dark economic.,0
138,P9106,U61968,Rebecca Barnett,3,8,1,1273284036,Blood east mind get weight push hit modern.,Deal activity assume seven on. Same writer kitchen say lawyer. About off like look per kind central.,0
139,P1882,U96748,Wesley Mitchell,3,3,4,1374436459,Hand glass sound material.,Real take success never by low. Agree build often laugh. Opportunity law leave mention tough Mr. Wrong grow shoulder most. Meet employee my along use edge later huge. Name state operation director care enter themselves. But public air ten. Security remember school move course.,0
140,P2418,U18314,Nicole Dunn,3,8,4,1272395757,Its newspaper garden physical issue issue theory up card soon quality.,Hour reason such several camera. Nothing past agreement board second yet. East clearly article add. Start eight focus change age prepare. Line official mean age job past onto. Military word story continue fall happen. Result figure reduce enter allow quality.,0
141,P8309,U75483,Katherine Hart,7,7,5,1497852213,It final they as brother president military attorney morning history four official PM.,Charge toward exist agreement. Network enough strategy this. Worker sort face whether.,0
142,P3145,U35392,Jamie Smith,3,9,3,1536073114,News character all lose make response interest.,Mother budget whom account finish carry. Spring financial alone.,0
143,P4774,U31818,Nicole Steele,5,9,3,1215376348,Message interest spring have still only control middle explain.,Single five important want likely. Fund nothing social born trial including fast.,0
144,P2509,U95589,Brenda Haynes,3,3,3,1201644041,Enter view over message go.,War rise turn prove oil. Money represent interesting on early media. Play draw change smile.,0
145,P6085,U69923,Robert Reese,0,1,5,1392178846,One newspaper ago project few now pressure enough authority anything.,Agree drive newspaper economic case fear. Woman brother surface central authority feel professional. Fish fire from day able. Full kitchen likely could may opportunity. Middle mind billion various mind compare body.,0
146,P7202,U32571,Joel Cherry,6,10,4,1695360221,Determine risk all look left.,Why fact sound. Tough season benefit coach happen feeling each.,0
147,P8012,U74263,Michael Fox,2,7,2,1545493892,First music suddenly wall only former finish camera realize none reveal.,Statement have bag control watch before. Listen trouble particular training. Method system low adult. Teacher recent while head watch. Property evening current by trial. American computer brother drop begin. Box a where message mention.,0
148,P1146,U80587,Timothy Foster,4,9,3,1578635557,Himself price almost decade do find yet nearly much.,Within debate effect recently expert and. According behavior stop sit ten. Necessary place may set trouble station including.,0
149,P7056,U65853,James Barker,0,2,1,1369992780,Election beat within ready service seem position turn.,Suffer senior mind go. Including can property watch vote. Term opportunity today arm administration all near. Keep blood able analysis issue fall. Feel wish production feeling decade return moment.,0
150,P3244,U30347,Andrea Davis,9,10,3,1674137729,Policy relate small cold recognize difficult once pick response job.,So improve exist measure. Teacher meet cup pay coach back.,0
151,P2111,U17549,Chad Shepherd,6,9,1,1475961794,Result remain physical establish this hit.,Rule international run heart. Wall many likely name. Until clear memory early range environmental. Budget wife case have.,0
152,P7936,U29819,Jason Shields,0,1,5,1482231813,Land include smile generation decision magazine term girl ball.,Recognize maybe course sea available. Enter author brother per. These matter less remain. Capital large determine throughout push benefit.,0
153,P2205,U91789,Mike Sanders,5,9,1,1651651388,Feeling something imagine price.,You dinner on second here leg. Think many like local. Contain air manage current. On who likely important cover the series.,0
154,P3275,U39460,Antonio Hernandez,3,8,3,1305802639,Need weight improve tell yeah task.,Choose know man challenge majority ability. Fight bag lead suffer sing office. Vote senior share artist. Report item detail what through.,0
155,P5717,U80818,Thomas Booker,4,4,5,1547105573,Shoulder here name fund.,Author drive apply result character child. Share I station others task site. Wrong event check still product. Yourself conference camera whom last when. Learn under check attack research teach pattern.,0
156,P5066,U88328,George Cannon,2,10,3,1269291497,Practice until evidence most interview cup general.,Pm want dinner themselves word future kitchen plant. Front partner bill quality child church TV.,0
157,P5794,U18423,Shelly Baker,2,5,2,1475226525,Some glass end manage spring customer base or.,Certainly guess company which matter author remain. At region computer camera. Pressure tree full quality modern simply. Within center message. Recently physical art everything pattern try feel. At white likely continue lot. Side moment open.,0
158,P6119,U97322,Michael Schneider,0,10,1,1390325730,Result end produce effort door say easy offer.,Book remain down fast. High effort another.,0
159,P3354,U92465,Debbie Wheeler,5,8,1,1239259927,Nothing audience amount determine true item police interest.,Shake list a contain fact person another. Project miss religious when. Tonight realize fly gas ever Mr matter. Dark democratic against effect. Share mission peace whole.,0
160,P9780,U40349,Gloria Vargas,0,7,4,1501856426,Hot purpose performance discuss town successful number eye manage PM government respond.,Body edge nature itself. Well participant involve race. Break article together risk fast. We more resource certainly well prevent nation.,0
161,P8524,U81957,Elijah Miller,1,9,2,1206648514,Contain paper least fly.,Character early good buy give. Likely age enjoy happy. Lose discuss consumer collection. Parent outside sell budget seek force letter be. Black yard so direction. Light smile these focus say radio.,0
162,P4536,U33955,Nichole Morgan,1,2,1,1375857474,Speech hit cold far exist game go police.,Size protect office expect main although there explain. Remember part specific support represent bad remain. Ability leave third employee five present action. View term exactly money film level.,0
163,P2743,U50423,Christopher Watson,3,4,4,1448483372,Within away gun option answer nothing evidence also.,Coach personal practice be.,0
164,P8898,U31005,Michael Dominguez,6,8,1,1478912048,Five challenge me probably style apply community nor act eye road appear.,Attorney defense sell past. Must say animal arrive relate. Free into sing drop great light. Girl shake reason across. Above box recently top. Fight western hard strong small. Toward movement similar hope day age across.,0
165,P8827,U32267,Micheal Hanson,5,8,3,1641272313,Break yes brother window affect attention against share quality.,Small late staff production expert whom step. Test different result full whose. Media network perform business contain.,0
166,P2419,U17429,Felicia Ortiz,8,10,1,1480788143,At as their within best set.,Bad now arrive ability big small. Official structure effort eight public speak develop. Now race car tend.,0
167,P3589,U83870,Terri Nelson,0,2,2,1569712024,Company so traditional economy.,Memory tree improve hundred kind never network. Trial into newspaper truth indeed. Beat gun daughter end who old.,0
168,P6877,U65698,Brittany Murray,0,7,3,1346296632,Action up mission measure film enjoy.,Room difficult image matter. Usually option gas my attention. Half bit after investment six ground gun. Dinner him popular central worker article.,0
169,P8543,U44483,Kenneth Lawrence,0,6,1,1625873489,Affect more leave movement someone.,Class official hear well important everyone impact. Friend feel hold movie.,0
170,P4369,U91464,Kristen Smith,0,10,1,1445958724,True should soldier her ok far plant myself.,Follow might natural miss movement market. Bill line what common.,0
171,P3943,U79173,Laura Maddox,9,10,1,1621493498,Matter boy article.,Bill amount grow miss. At fear energy word chair great project. Card a race. Public choose news career man.,0
172,P8408,U59767,Joshua Owen,6,6,4,1558109720,Draw blue view result trade.,Hear loss resource school cultural Democrat argue. Respond discover simply writer whatever somebody as say. Not information American rather. Recognize evidence film tree sister ready clearly. Middle air pull perform view. Mean check capital tree ago.,0
173,P9724,U27924,Mikayla Bradley,1,4,5,1442067290,Score campaign yourself describe travel operation.,Oil with your put. Name citizen fund set sure produce form. Member owner employee attack. Whole network front.,0
174,P7143,U73612,Adam Simmons,0,8,3,1513352975,Simply single through rise hard their born tend.,You shoulder environmental partner take. Me environmental least. Success fly single upon want finally change word.,0
175,P6945,U33410,Michelle Ramirez,1,5,2,1299993319,Spend everything audience allow half contain.,Concern what success production collection administration carry. Take responsibility outside single. Involve son age culture. Green follow model read win language movie debate.,0
176,P7962,U69979,Richard Anderson,5,7,5,1383533821,Individual poor there table movement well especially spend.,Add check language PM available notice.,0
177,P2659,U28445,Anne Obrien,4,7,5,1331157577,Give five positive hospital partner without tax production most.,Situation among hear pull behind son see. Store about staff arrive state lot.,0
178,P2536,U86509,Angela Rhodes,1,1,3,1525482305,Real themselves group guess property hope live line.,Term treatment civil join sometimes. Condition necessary but room huge team look. Foreign air least able.,0
179,P4444,U14508,Charles Herman,9,9,3,1558120961,Into pretty history whatever everybody case for dog.,Next spring almost garden. Address risk then cold first represent prevent agent. Movement alone lead suggest force artist machine may. Four somebody magazine give be full remember water. New provide meet system.,0
180,P1064,U11321,Michelle Hayden,1,7,2,1613338081,Loss minute face fall far least news strong.,Possible early can meet sound common ask raise. Require property ability. Lawyer eight deal southern. Science build heart even girl machine politics. Community behind spring end beat would else.,0
181,P2542,U22745,Patrick Fisher,2,5,5,1610203134,Support event up right avoid.,High actually fine service wind claim discuss finish. Southern smile care station. Design phone skin friend man local of. Yourself place half crime television.,0
182,P6177,U21808,Matthew Jackson,9,9,1,1513247181,House ever air suffer different experience feeling.,Personal last rise peace live born. Check discuss production marriage.,0
183,P7521,U20735,Robert Drake,3,6,3,1227734064,Cause never matter fund will sing physical role pressure lose town.,Production record various hope. Federal Republican fine drug according eye forward.,0
184,P5509,U28691,Mrs. Melinda Robertson,2,3,2,1598222382,Specific bit full type usually old view analysis physical.,Condition water beautiful difference. Allow part low believe paper heavy economy wrong. Travel how modern front. Key pick continue. Break up picture almost maintain prove.,0
185,P3930,U45983,Gina Kane,0,6,1,1566480835,Fear appear particular report owner find those much home.,Explain around effort oil agree reason spend. Expert specific support reduce figure. Develop win general offer book family. Study person visit director remember recognize go walk.,0
186,P1011,U23185,Joseph Rivera,7,9,5,1539053254,Floor inside truth born service picture our with often speak.,Operation offer phone. Sport half capital cup.,0
187,P6396,U89183,Kristopher Rodriguez,1,2,2,1649033592,Clearly such cultural.,Sing defense space event bring often. Economic term rather too. Learn education land laugh two herself agent. Every feeling many.,0
188,P1905,U65589,Brian Dixon,2,3,1,1588172954,Return thing care to.,Including plan play generation current owner human. Three heavy technology really turn.,0
189,P3120,U75165,Eric Price,1,3,4,1650557731,Us then cut remember eat many cold happen.,Money letter yeah responsibility smile though. Everybody check buy popular remember material clear.,0
190,P7418,U51614,George Quinn,7,7,5,1492748228,Bank environmental parent language simply serve point war form several.,Add under whole vote new cultural. Training hospital evening current certainly single accept. Force population us. Amount really current near choice baby sister. Could matter evidence memory experience save even.,0
191,P7224,U63119,Jimmy Marshall,1,3,4,1629210902,Policy able box soon policy go senior.,Wear once federal difficult every rock space. Cup message by matter town data reflect. Right sort draw whatever. Herself teacher to thing end left. Wrong along include begin you born. Campaign front store wait tend tough. Hit special individual country allow world home.,0
192,P8613,U55979,Peter Glover,5,5,4,1596518113,Identify war because free way account chance entire energy.,Rate poor visit participant score. Fact statement subject source eight house.,0
193,P7718,U75812,Jessica Clark,1,3,4,1581916687,Meet threat act real part good.,Business rock ready space provide occur measure. Protect receive perform health owner wife six day. Sure article your fact. Kitchen whom worker partner science. Hold huge start easy what watch. Or arrive food attention.,0
194,P1158,U51915,Matthew Walters,4,6,4,1551893420,View letter never listen writer lawyer organization collection citizen.,Head rich cover beyond floor already before region. Suggest dog nation part.,0
195,P8625,U95053,Erik Ramos Jr.,6,7,4,1462879215,Audience product choice middle blue head responsibility hair identify suddenly choose father past.,Subject dog ask late huge stop win. Available and unit ground choose. Experience wait goal very. Just several low bar factor. Modern movie agree. Area sense more effect wonder.,0
196,P5051,U42475,Laurie Phillips,5,9,2,1295429081,Right week eight put.,Condition skill note chance mention. Very skill kitchen direction safe loss impact new. Century food make capital window. Condition environment between. Later civil born participant sound we myself. Challenge man manage behavior person. Leader evening enjoy open look.,0
197,P6135,U62990,Ronald Ibarra,1,4,2,1518428285,Themselves far today everyone top customer test.,Goal task whatever along. Then interest attack picture those. Gas training college often weight century fine. Bank must somebody magazine prevent. Ground vote sport local. Assume several investment system girl determine.,0
198,P6195,U94190,Katelyn Harris,7,9,5,1555329678,Couple door state else dog skin night.,Candidate service military husband student color. Physical rest type until raise officer.,0
199,P4196,U89811,Peter Anthony,0,2,3,1571536830,Clear arrive end according writer truth training opportunity nothing off.,Both their close table financial perhaps south. Style organization identify more during.,0
200,P8355,U81241,Diane Wiley,0,1,4,1552003576,Fine possible you fill fast sense stop tree pretty several the.,Star approach report face. Month return create art partner. Gas feel yard measure court you thousand business. Stay performance wrong true involve. Vote career age but say front. New admit simple life maybe. Box across rich single economy. Guess glass perform federal.,0
201,P6632,U75018,Tony Ortiz,1,2,5,1509360748,Former remember later home film affect sit.,List adult sound well wife so. Prove feel figure back consumer against energy save. South blood miss enough only ago. Land job thing suddenly. Crime cost life away thus.,0
202,P8410,U82623,Dale Allison,0,3,3,1283949693,Benefit finally sister most director success result center offer.,Agreement tax let back close senior. Adult early throughout anything exactly capital continue. Group rest real tend teach begin. Discover thousand despite glass.,0
203,P1037,U83475,Ryan Spears,5,7,3,1455101906,Effect among pull by.,Upon staff enough. General clearly economic arm part the radio. Professor rich new difficult measure strategy. Thing fire pick use we necessary defense. Determine just the maintain adult need industry. Recently you machine start according important he. Upon among source manage. Blue during night.,0
204,P3442,U45866,Brianna Hernandez,1,5,4,1354339635,Card attack road analysis decide turn become son between mention personal.,Art sense table. Important stay data industry surface wonder form. Help civil clearly avoid amount remember anything. Hit them serve house concern memory. Floor election travel others edge right structure.,0
205,P1350,U69655,Matthew Gonzalez DVM,0,4,3,1460406518,Difficult you role modern born figure green understand present thank eye her.,Difference final east less. Road hot Republican activity network store. Hard benefit response language add light.,0
206,P5869,U10780,Thomas Cook,0,4,1,1236125212,Staff audience benefit report fine.,Sort occur very trial. Budget say during face even article. Benefit late public word. Administration up ten certain watch again.,0
207,P3976,U36292,Karen Peterson,2,10,4,1555845599,Great civil other scientist eight however.,Form letter large best. Debate security society. Knowledge federal course serious. Set step role eight. Which financial late as hold protect civil politics. Interest listen when PM couple career. Then scientist factor lose least.,0
208,P4880,U36574,Caroline Davis,5,6,4,1494707864,Continue answer reason choose reveal kid.,Baby throw paper young buy. Above college evidence before. Threat check tax doctor. Thousand discuss institution. Carry natural between table. Artist politics all also reduce wait time.,0
209,P9841,U56140,Randy Edwards,6,9,5,1682800153,Customer service term anyone interest.,Spring very actually yet customer reality range. Doctor money leave thank town. Affect capital identify rise off. Tonight present particularly heart city media cover. Price fly spring increase off. List scientist trial finally score focus hard.,0
210,P5619,U66629,Amanda Johnson,1,1,1,1450162456,Upon force out next major especially recognize hospital.,Sister career growth her nearly. Different act within keep letter involve choice. Challenge do challenge break term data.,0
211,P7001,U60557,Rebecca Rivera,4,5,1,1412093395,Teach interesting visit method always.,Throughout dinner within letter tonight red since. Son culture wait reveal president try defense. Leave alone think.,0
